{
    "bomFormat": "ConcertDef",
    "specVersion": "1.0.2",
    "metadata": {
        "timestamp": "2025-02-17T09:53:18Z",
        "type": "application",
        "component": {
            "name": "encoreapp",
            "version": "1.0.0"
        },
        "business": {
            "name": "Concert Sample Co.",
            "units": [
                {
                    "name": "Software",
                    "email": "concert@ibm.com",
                    "phone": "+1-877-426-6006"
                }
            ]
        }
    },
    "environments": [
        {
            "bom-ref": "environment:ibmc_prod",
            "type": "environment",
            "name": "ibmc_prod"
        }
    ],
    "components": [
        {
            "bom-ref": "build:mern-react-app",
            "type": "build",
            "name": "mern-react-app",
            "version": "1.0.0"
        },
        {
            "bom-ref": "build:mern-node-app",
            "type": "build",
            "name": "mern-node-app",
            "version": "1.0.0"
        }
    ],
    "properties": [
        {
            "name": "application_criticality",
            "value": "4"
        },
        {
            "name": "application_data_assessment_impact_risk",
            "value": "5"
        },
        {
            "name": "revenue",
            "value": "1000"
        }
    ],
    "services": [
        {
            "bom-ref": "appapi:mern-react-app",
            "name": "mern-react-app",
            "endpoints": [
                "/"
            ]
        },
        {
            "bom-ref": "appapi:mern-node-app",
            "name": "mern-node-app",
            "endpoints": [
                "/v1/user/*",
                "/",
                "/v1/channels/",
                "/v1/channels/find",
                "/v1/channels/add",
                "/v1/channels/getChannelDetail",
                "/v1/message",
                "/v1/message/*"
            ],
            "properties": [
                {
                    "name": "network_exposure",
                    "value": "public"
                }
            ]
        }
    ],
    "dependencies": [
        {
            "ref": "build:mern-react-app",
            "dependsOn": [
                "appapi:mern-react-app"
            ]
        },
        {
            "ref": "build:mern-node-app",
            "dependsOn": [
                "appapi:mern-node-app"
            ]
        }
    ]
}